<xs:schema xmlns:tns="http://www.eclaimlink.ae/DHD/ValidationSchema" elementFormDefault="qualified" version="2.0" id="RemittanceAdvice" xmlns:xs="http://www.w3.org/2001/XMLSchema">
    <xs:import schemaLocation="CommonTypes.xsd" namespace="http://www.eclaimlink.ae/DHD/ValidationSchema" />
    <xs:element name="Remittance.Advice">
        <xs:complexType>
            <xs:sequence>
                <xs:element minOccurs="1" maxOccurs="1" name="Header">
                    <xs:complexType>
                        <xs:sequence>
                            <xs:element minOccurs="1" maxOccurs="1" name="SenderID" type="tns:HeaderSenderID" />
                            <xs:element minOccurs="1" maxOccurs="1" name="ReceiverID" type="tns:HeaderReceiverID" />
                            <xs:element minOccurs="1" maxOccurs="1" name="TransactionDate" type="tns:HeaderTransactionDate" />
                            <xs:element minOccurs="1" maxOccurs="1" name="RecordCount" type="tns:HeaderRecordCount" />
                            <xs:element minOccurs="1" maxOccurs="1" name="DispositionFlag" type="tns:HeaderDispositionFlag" />
                        </xs:sequence>
                    </xs:complexType>
                </xs:element>
                <xs:element minOccurs="1" maxOccurs="unbounded" name="Claim">
                    <xs:complexType>
                        <xs:sequence>
                            <xs:element minOccurs="1" maxOccurs="1" name="ID" type="tns:ClaimID" />
                            <xs:element minOccurs="1" maxOccurs="1" name="IDPayer" type="tns:ClaimIDPayer" />
                            <xs:element minOccurs="0" maxOccurs="1" name="ProviderID" type="tns:ClaimProviderID" />
                            <xs:element minOccurs="0" maxOccurs="1" name="DenialCode" type="tns:ClaimDenialCode" />
                            <xs:element minOccurs="1" maxOccurs="1" name="PaymentReference" type="tns:ClaimPaymentReference" />
                            <xs:element minOccurs="0" maxOccurs="1" name="DateSettlement" type="tns:ClaimDateSettlement" />
                            <xs:element minOccurs="0" maxOccurs="1" name="Encounter">
                                <xs:complexType>
                                    <xs:sequence>
                                        <xs:element minOccurs="0" maxOccurs="1" name="FacilityID" type="tns:EncounterFacilityID" />
                                    </xs:sequence>
                                </xs:complexType>
                            </xs:element>
                            <xs:element minOccurs="1" maxOccurs="unbounded" name="Activity">
                                <xs:complexType>
                                    <xs:sequence>
                                        <xs:element minOccurs="1" maxOccurs="1" name="ID" type="tns:ActivityID" />
                                        <xs:element minOccurs="1" maxOccurs="1" name="Start" type="tns:ActivityStart" />
                                        <xs:element minOccurs="1" maxOccurs="1" name="Type" type="tns:ActivityType" />
                                        <xs:element minOccurs="1" maxOccurs="1" name="Code" type="tns:ActivityCode" />
                                        <xs:element minOccurs="1" maxOccurs="1" name="Quantity" type="tns:ActivityQuantity" />
                                        <xs:element minOccurs="1" maxOccurs="1" name="Net" type="tns:ActivityNet" />
                                        <xs:element minOccurs="0" maxOccurs="1" name="List" type="tns:ActivityList" />
                                        <xs:element minOccurs="1" maxOccurs="1" name="Clinician" type="tns:ActivityClinician" />
                                        <xs:element minOccurs="0" maxOccurs="1" name="PriorAuthorizationID" type="tns:ActivityPriorAuthorizationID" />
                                        <xs:element minOccurs="0" maxOccurs="1" name="Gross" type="tns:ActivityGross" />
                                        <xs:element minOccurs="0" maxOccurs="1" name="PatientShare" type="tns:ActivityPatientShare" />
                                        <xs:element minOccurs="1" maxOccurs="1" name="PaymentAmount" type="tns:ActivityPaymentAmount" />
                                        <xs:element minOccurs="0" maxOccurs="1" name="DenialCode" type="tns:ActivityDenialCode" />
                                    </xs:sequence>
                                </xs:complexType>
                            </xs:element>
                        </xs:sequence>
                    </xs:complexType>
                </xs:element>
            </xs:sequence>
        </xs:complexType>
    </xs:element>
</xs:schema>