<?xml version="1.0" encoding="utf-8"?>
<Remittance.Advice xmlns:tns="http://www.eclaimlink.ae/DHD/ValidationSchema" xmlns:xsi="http://www.w3.org/2001/XMLSchema-instance" xsi:noNamespaceSchemaLocation="http://www.eclaimlink.ae/DHD/ValidationSchema/RemittanceAdvice.xsd">
  <Header>
    <SenderID>INS012</SenderID>
    <ReceiverID>DHA-F-0045446</ReceiverID>
    <TransactionDate>03/09/2025 11:54</TransactionDate>
    <RecordCount>1</RecordCount>
    <DispositionFlag>PRODUCTION</DispositionFlag>
  </Header>
  <Claim>
    <ID>DLJOI1021613882</ID>
    <IDPayer>68011615</IDPayer>
    <ProviderID>DHA-F-0045446</ProviderID>
    <PaymentReference>80638543</PaymentReference>
    <DateSettlement>01/09/2025 00:00</DateSettlement>
    <Comments>Activity ID: 300141 - AUTH-003</Comments>
    <Encounter>
      <FacilityID>DHA-F-0045446</FacilityID>
    </Encounter>
    <Activity>
      <ID>300142</ID>
      <Start>13/06/2025 05:03</Start>
      <Type>8</Type>
      <Code>10</Code>
      <Quantity>1</Quantity>
      <Net>144</Net>
      <Clinician>DHA-P-0128573</Clinician>
      <Gross>180</Gross>
      <PatientShare>36</PatientShare>
      <PaymentAmount>144</PaymentAmount>
    </Activity>
  </Claim>
</Remittance.Advice>