<?xml version="1.0" encoding="utf-8"?>
<Remittance.Advice xmlns:tns="http://www.eclaimlink.ae/DHD/ValidationSchema" xmlns:xsi="http://www.w3.org/2001/XMLSchema-instance" xsi:noNamespaceSchemaLocation="http://www.eclaimlink.ae/DHD/ValidationSchema/RemittanceAdvice.xsd">
  <Header>
    <SenderID>TPA004</SenderID>
    <ReceiverID>DHA-F-0045446</ReceiverID>
    <TransactionDate>02/09/2025 22:15</TransactionDate>
    <RecordCount>1</RecordCount>
    <DispositionFlag>PRODUCTION</DispositionFlag>
  </Header>
  <Claim>
    <ID>DLJOI1021613219</ID>
    <IDPayer>8865317-34</IDPayer>
    <ProviderID>DHA-F-0045446</ProviderID>
    <PaymentReference>GC03_PHUB528147892</PaymentReference>
    <DateSettlement>02/09/2025 22:15</DateSettlement>
    <Comments>
    </Comments>
    <Encounter>
      <FacilityID>DHA-F-0045446</FacilityID>
    </Encounter>
    <Activity>
      <ID>200113031</ID>
      <Start>09/06/2025 20:11</Start>
      <Type>3</Type>
      <Code>85025</Code>
      <Quantity>1</Quantity>
      <Net>111.72</Net>
      <List>111.72</List>
      <Clinician>DHA-P-30387015</Clinician>
      <PatientShare>0</PatientShare>
      <PaymentAmount>0</PaymentAmount>
      <DenialCode>MNEC-005</DenialCode>
    </Activity>
    <Activity>
      <ID>200114091</ID>
      <Start>09/06/2025 20:11</Start>
      <Type>3</Type>
      <Code>86140</Code>
      <Quantity>1</Quantity>
      <Net>111.72</Net>
      <List>111.72</List>
      <Clinician>DHA-P-30387015</Clinician>
      <PatientShare>0</PatientShare>
      <PaymentAmount>0</PaymentAmount>
      <DenialCode>MNEC-005</DenialCode>
    </Activity>
    <Activity>
      <ID>300162571</ID>
      <Start>09/06/2025 20:11</Start>
      <Type>3</Type>
      <Code>96365</Code>
      <Quantity>1</Quantity>
      <Net>96.04</Net>
      <List>96.04</List>
      <Clinician>DHA-P-30387015</Clinician>
      <Gross>96.04</Gross>
      <PatientShare>0</PatientShare>
      <PaymentAmount>96.04</PaymentAmount>
    </Activity>
  </Claim>
</Remittance.Advice>