<Remittance.Advice xmlns:tns="http://www.eclaimlink.ae/DataDictionary/CommonTypes" xmlns:xsi="http://www.w3.org/2001/XMLSchema-instance" xsi:noNamespaceSchemaLocation="http://www.eclaimlink.ae/DataDictionary/CommonTypes/RemittanceAdvice.xsd"><Header><SenderID>TPA002</SenderID><ReceiverID>DHA-F-0045446</ReceiverID><TransactionDate>03/09/2025 11:12</TransactionDate><RecordCount>1</RecordCount><DispositionFlag>PRODUCTION</DispositionFlag></Header><Claim><ID>DLJOI1021616259</ID><IDPayer>24317607-112-2</IDPayer><ProviderID>DHA-F-0045446</ProviderID><PaymentReference>2621190</PaymentReference><DateSettlement>02/09/2025 00:00</DateSettlement><Comments></Comments><Encounter><FacilityID>DHA-F-0045446</FacilityID></Encounter><Activity><ID>300164121</ID><Start>25/06/2025 12:24</Start><Type>3</Type><Code>99195</Code><Quantity>1</Quantity><Net>263.69</Net><Clinician>DHA-P-0250490</Clinician><PaymentAmount>263.69</PaymentAmount></Activity><Activity><ID>300162641</ID><Start>25/06/2025 12:24</Start><Type>3</Type><Code>96372</Code><Quantity>1</Quantity><Net>31.21</Net><Clinician>DHA-P-0250490</Clinician><PaymentAmount>31.21</PaymentAmount></Activity><Activity><ID>300121</ID><Start>25/06/2025 12:24</Start><Type>8</Type><Code>9.01</Code><Quantity>1</Quantity><Net>0</Net><Clinician>DHA-P-0250490</Clinician><PaymentAmount>0</PaymentAmount></Activity><Activity><ID>3001137961</ID><Start>25/06/2025 12:24</Start><Type>5</Type><Code>0717-378503-1021</Code><Quantity>3</Quantity><Net>19.2</Net><Clinician>DHA-P-0250490</Clinician><PaymentAmount>19.2</PaymentAmount></Activity><Activity><ID>200113031</ID><Start>25/06/2025 12:24</Start><Type>3</Type><Code>85025</Code><Quantity>1</Quantity><Net>92.64</Net><Clinician>DHA-P-0250490</Clinician><PaymentAmount>92.64</PaymentAmount></Activity></Claim></Remittance.Advice>
