<Remittance.Advice xsi:noNamespaceSchemaLocation="RemittanceAdvice.xsd" xmlns:xsi="http://www.w3.org/2001/XMLSchema-instance">
    <Header>
        <SenderID>TPA-XYZ</SenderID><ReceiverID>FAC-001</ReceiverID>
        <TransactionDate>24/02/2025 22:41</TransactionDate>
        <RecordCount>1</RecordCount><DispositionFlag>PRODUCTION</DispositionFlag>
    </Header>
    <Claim>
        <ID>R-MULTI-1</ID>
        <IDPayer>PAY-1</IDPayer>
        <ProviderID>FAC-001</ProviderID>
        <PaymentReference>PR-003</PaymentReference>
        <DateSettlement>21/02/2025 00:00</DateSettlement>
        <Activity>
            <ID>RA-1</ID><Start>21/02/2025 00:00</Start><Type>3</Type><Code>85025</Code>
            <Quantity>1</Quantity><Net>111.72</Net><Clinician>DHA-P-0001</Clinician>
            <Gross>111.72</Gross><PatientShare>0</PatientShare><PaymentAmount>111.72</PaymentAmount>
        </Activity>
        <Activity>
            <ID>RA-2</ID><Start>21/02/2025 00:00</Start><Type>3</Type><Code>86141</Code>
            <Quantity>1</Quantity><Net>108.19</Net><Clinician>DHA-P-0001</Clinician>
            <List>108.19</List><PaymentAmount>108.19</PaymentAmount>
        </Activity>
    </Claim>
</Remittance.Advice>
